[
  {
    "externalId": "FERDI-DEMO-L1-01-V2",
    "type": "SINGLE_CHOICE",
    "chapterCode": "DEMO-FERDI-ALG",
    "subchapterCode": "DEMO-FERDI-LINEAR",
    "competencyCode": "DEMO-FERDI-EQUATION-L1",
    "levelCode": "DEMO-FERDI-L1",
    "difficulty": "EASY",
    "stem": {
      "text": "Tentukan nilai x yang memenuhi persamaan 2x + 3 = 17."
    },
    "options": [
      {
        "id": "A",
        "content": {
          "text": "5"
        }
      },
      {
        "id": "B",
        "content": {
          "text": "7"
        }
      },
      {
        "id": "C",
        "content": {
          "text": "6"
        }
      },
      {
        "id": "D",
        "content": {
          "text": "8"
        }
      }
    ],
    "answer": {
      "optionId": "B"
    },
    "explanation": {
      "text": "Model persamaan: 2x + 3 = 17. Kurangi kedua ruas dengan 3 sehingga 2x = 14. Bagi kedua ruas dengan 2: x = 7. Pemeriksaan: 2 * 7 + 3 = 17."
    },
    "metadata": {
      "source": "DEMO candidate prepared by Ferdi for Curriculum review, 2026-10-02",
      "isDemo": true,
      "contentStatus": "DRAFT",
      "curriculumReviewed": false,
      "reviewer": null,
      "familyExternalId": "FERDI-DEMO-L1-01",
      "variantCode": "V2",
      "originalExternalId": "FERDI-DEMO-L1-01-V1",
      "equivalenceReview": "PENDING_CURRICULUM",
      "displayOrder": 1,
      "coefficients": {
        "a": 2,
        "b": 3,
        "c": 17,
        "expectedX": 7
      }
    }
  },
  {
    "externalId": "FERDI-DEMO-L1-02-V2",
    "type": "SINGLE_CHOICE",
    "chapterCode": "DEMO-FERDI-ALG",
    "subchapterCode": "DEMO-FERDI-LINEAR",
    "competencyCode": "DEMO-FERDI-EQUATION-L1",
    "levelCode": "DEMO-FERDI-L1",
    "difficulty": "EASY",
    "stem": {
      "text": "Tentukan nilai x yang memenuhi persamaan 3x + 4 = 28."
    },
    "options": [
      {
        "id": "A",
        "content": {
          "text": "6"
        }
      },
      {
        "id": "B",
        "content": {
          "text": "7"
        }
      },
      {
        "id": "C",
        "content": {
          "text": "8"
        }
      },
      {
        "id": "D",
        "content": {
          "text": "9"
        }
      }
    ],
    "answer": {
      "optionId": "C"
    },
    "explanation": {
      "text": "Model persamaan: 3x + 4 = 28. Kurangi kedua ruas dengan 4 sehingga 3x = 24. Bagi kedua ruas dengan 3: x = 8. Pemeriksaan: 3 * 8 + 4 = 28."
    },
    "metadata": {
      "source": "DEMO candidate prepared by Ferdi for Curriculum review, 2026-10-02",
      "isDemo": true,
      "contentStatus": "DRAFT",
      "curriculumReviewed": false,
      "reviewer": null,
      "familyExternalId": "FERDI-DEMO-L1-02",
      "variantCode": "V2",
      "originalExternalId": "FERDI-DEMO-L1-02-V1",
      "equivalenceReview": "PENDING_CURRICULUM",
      "displayOrder": 2,
      "coefficients": {
        "a": 3,
        "b": 4,
        "c": 28,
        "expectedX": 8
      }
    }
  },
  {
    "externalId": "FERDI-DEMO-L1-03-V2",
    "type": "SINGLE_CHOICE",
    "chapterCode": "DEMO-FERDI-ALG",
    "subchapterCode": "DEMO-FERDI-LINEAR",
    "competencyCode": "DEMO-FERDI-EQUATION-L1",
    "levelCode": "DEMO-FERDI-L1",
    "difficulty": "EASY",
    "stem": {
      "text": "Tentukan nilai x yang memenuhi persamaan 2x + 14 = 38."
    },
    "options": [
      {
        "id": "A",
        "content": {
          "text": "10"
        }
      },
      {
        "id": "B",
        "content": {
          "text": "11"
        }
      },
      {
        "id": "C",
        "content": {
          "text": "13"
        }
      },
      {
        "id": "D",
        "content": {
          "text": "12"
        }
      }
    ],
    "answer": {
      "optionId": "D"
    },
    "explanation": {
      "text": "Model persamaan: 2x + 14 = 38. Kurangi kedua ruas dengan 14 sehingga 2x = 24. Bagi kedua ruas dengan 2: x = 12. Pemeriksaan: 2 * 12 + 14 = 38."
    },
    "metadata": {
      "source": "DEMO candidate prepared by Ferdi for Curriculum review, 2026-10-02",
      "isDemo": true,
      "contentStatus": "DRAFT",
      "curriculumReviewed": false,
      "reviewer": null,
      "familyExternalId": "FERDI-DEMO-L1-03",
      "variantCode": "V2",
      "originalExternalId": "FERDI-DEMO-L1-03-V1",
      "equivalenceReview": "PENDING_CURRICULUM",
      "displayOrder": 3,
      "coefficients": {
        "a": 2,
        "b": 14,
        "c": 38,
        "expectedX": 12
      }
    }
  },
  {
    "externalId": "FERDI-DEMO-L1-04-V2",
    "type": "SINGLE_CHOICE",
    "chapterCode": "DEMO-FERDI-ALG",
    "subchapterCode": "DEMO-FERDI-LINEAR",
    "competencyCode": "DEMO-FERDI-EQUATION-L1",
    "levelCode": "DEMO-FERDI-L1",
    "difficulty": "EASY",
    "stem": {
      "text": "Tentukan nilai x yang memenuhi persamaan 4x + 5 = 49."
    },
    "options": [
      {
        "id": "A",
        "content": {
          "text": "11"
        }
      },
      {
        "id": "B",
        "content": {
          "text": "9"
        }
      },
      {
        "id": "C",
        "content": {
          "text": "10"
        }
      },
      {
        "id": "D",
        "content": {
          "text": "12"
        }
      }
    ],
    "answer": {
      "optionId": "A"
    },
    "explanation": {
      "text": "Model persamaan: 4x + 5 = 49. Kurangi kedua ruas dengan 5 sehingga 4x = 44. Bagi kedua ruas dengan 4: x = 11. Pemeriksaan: 4 * 11 + 5 = 49."
    },
    "metadata": {
      "source": "DEMO candidate prepared by Ferdi for Curriculum review, 2026-10-02",
      "isDemo": true,
      "contentStatus": "DRAFT",
      "curriculumReviewed": false,
      "reviewer": null,
      "familyExternalId": "FERDI-DEMO-L1-04",
      "variantCode": "V2",
      "originalExternalId": "FERDI-DEMO-L1-04-V1",
      "equivalenceReview": "PENDING_CURRICULUM",
      "displayOrder": 4,
      "coefficients": {
        "a": 4,
        "b": 5,
        "c": 49,
        "expectedX": 11
      }
    }
  },
  {
    "externalId": "FERDI-DEMO-L1-05-V2",
    "type": "SINGLE_CHOICE",
    "chapterCode": "DEMO-FERDI-ALG",
    "subchapterCode": "DEMO-FERDI-LINEAR",
    "competencyCode": "DEMO-FERDI-EQUATION-L1",
    "levelCode": "DEMO-FERDI-L1",
    "difficulty": "EASY",
    "stem": {
      "text": "Tentukan nilai x yang memenuhi persamaan 3x + 4 = 31."
    },
    "options": [
      {
        "id": "A",
        "content": {
          "text": "7"
        }
      },
      {
        "id": "B",
        "content": {
          "text": "9"
        }
      },
      {
        "id": "C",
        "content": {
          "text": "8"
        }
      },
      {
        "id": "D",
        "content": {
          "text": "10"
        }
      }
    ],
    "answer": {
      "optionId": "B"
    },
    "explanation": {
      "text": "Model persamaan: 3x + 4 = 31. Kurangi kedua ruas dengan 4 sehingga 3x = 27. Bagi kedua ruas dengan 3: x = 9. Pemeriksaan: 3 * 9 + 4 = 31."
    },
    "metadata": {
      "source": "DEMO candidate prepared by Ferdi for Curriculum review, 2026-10-02",
      "isDemo": true,
      "contentStatus": "DRAFT",
      "curriculumReviewed": false,
      "reviewer": null,
      "familyExternalId": "FERDI-DEMO-L1-05",
      "variantCode": "V2",
      "originalExternalId": "FERDI-DEMO-L1-05-V1",
      "equivalenceReview": "PENDING_CURRICULUM",
      "displayOrder": 5,
      "coefficients": {
        "a": 3,
        "b": 4,
        "c": 31,
        "expectedX": 9
      }
    }
  },
  {
    "externalId": "FERDI-DEMO-L1-06-V2",
    "type": "SINGLE_CHOICE",
    "chapterCode": "DEMO-FERDI-ALG",
    "subchapterCode": "DEMO-FERDI-LINEAR",
    "competencyCode": "DEMO-FERDI-EQUATION-L1",
    "levelCode": "DEMO-FERDI-L1",
    "difficulty": "EASY",
    "stem": {
      "text": "Tentukan nilai x yang memenuhi persamaan 2x + 8 = 36."
    },
    "options": [
      {
        "id": "A",
        "content": {
          "text": "12"
        }
      },
      {
        "id": "B",
        "content": {
          "text": "13"
        }
      },
      {
        "id": "C",
        "content": {
          "text": "14"
        }
      },
      {
        "id": "D",
        "content": {
          "text": "15"
        }
      }
    ],
    "answer": {
      "optionId": "C"
    },
    "explanation": {
      "text": "Model persamaan: 2x + 8 = 36. Kurangi kedua ruas dengan 8 sehingga 2x = 28. Bagi kedua ruas dengan 2: x = 14. Pemeriksaan: 2 * 14 + 8 = 36."
    },
    "metadata": {
      "source": "DEMO candidate prepared by Ferdi for Curriculum review, 2026-10-02",
      "isDemo": true,
      "contentStatus": "DRAFT",
      "curriculumReviewed": false,
      "reviewer": null,
      "familyExternalId": "FERDI-DEMO-L1-06",
      "variantCode": "V2",
      "originalExternalId": "FERDI-DEMO-L1-06-V1",
      "equivalenceReview": "PENDING_CURRICULUM",
      "displayOrder": 6,
      "coefficients": {
        "a": 2,
        "b": 8,
        "c": 36,
        "expectedX": 14
      }
    }
  },
  {
    "externalId": "FERDI-DEMO-L1-07-V2",
    "type": "SINGLE_CHOICE",
    "chapterCode": "DEMO-FERDI-ALG",
    "subchapterCode": "DEMO-FERDI-LINEAR",
    "competencyCode": "DEMO-FERDI-EQUATION-L1",
    "levelCode": "DEMO-FERDI-L1",
    "difficulty": "EASY",
    "stem": {
      "text": "Tentukan nilai x yang memenuhi persamaan 5x + 2 = 42."
    },
    "options": [
      {
        "id": "A",
        "content": {
          "text": "6"
        }
      },
      {
        "id": "B",
        "content": {
          "text": "7"
        }
      },
      {
        "id": "C",
        "content": {
          "text": "9"
        }
      },
      {
        "id": "D",
        "content": {
          "text": "8"
        }
      }
    ],
    "answer": {
      "optionId": "D"
    },
    "explanation": {
      "text": "Model persamaan: 5x + 2 = 42. Kurangi kedua ruas dengan 2 sehingga 5x = 40. Bagi kedua ruas dengan 5: x = 8. Pemeriksaan: 5 * 8 + 2 = 42."
    },
    "metadata": {